{
  "$schema": "https://json-schema.org/draft/2020-12/schema",
  "$id": "https://github.com/zqian6263-design/EvalPilot/schemas/workload.schema.json",
  "title": "EvalPilot external workload manifest",
  "description": "Authoring contract for the JSON file passed to EVALPILOT_WORKLOAD_FILE. The runtime loader (backend/evalpilot/fixtures.py::_load_workload) also accepts a bare array of scenarios and fills in defaults for absent fields, so it is deliberately more permissive than this published contract: this schema is what a workload should look like when it is authored and reviewed, and it is what scripts/validate-sut.ps1 checks before an external system under test is exercised.",
  "type": "object",
  "required": ["workload_id", "scenarios"],
  "additionalProperties": false,
  "properties": {
    "workload_id": {
      "type": "string",
      "minLength": 1,
      "description": "Stable identifier for this workload; used in reports and evidence."
    },
    "baseline_version": {
      "type": "string",
      "minLength": 1,
      "description": "Revision label of the known-good version. Must be advertised by the external SUT."
    },
    "candidate_version": {
      "type": "string",
      "minLength": 1,
      "description": "Revision label of the version under test. Must be advertised by the external SUT."
    },
    "source_issue": {
      "type": "string",
      "description": "Optional public issue or ticket this workload reproduces."
    },
    "source_fix": {
      "type": "string",
      "description": "Optional reference to the upstream fix, when one exists."
    },
    "scenarios": {
      "type": "array",
      "minItems": 1,
      "description": "One entry per scenario. Scenario ids must be unique; duplicate ids are rejected at load time.",
      "items": {
        "$ref": "#/$defs/scenario"
      }
    }
  },
  "$defs": {
    "stringList": {
      "type": "array",
      "items": {
        "type": "string",
        "minLength": 1
      }
    },
    "scenario": {
      "type": "object",
      "required": [
        "scenario_id",
        "question",
        "category",
        "difficulty",
        "expected_doc_ids",
        "must_include"
      ],
      "additionalProperties": false,
      "properties": {
        "scenario_id": {
          "type": "string",
          "minLength": 1,
          "description": "Stable scenario id. Cases are matched across versions on this value, so it must not change between runs."
        },
        "question": {
          "type": "string",
          "minLength": 1,
          "description": "The exact question sent to the external SUT."
        },
        "category": {
          "enum": ["normal", "boundary", "adversarial", "regression"],
          "description": "Scenario class. Matches the loader's allowed set."
        },
        "difficulty": {
          "type": "number",
          "minimum": 0,
          "maximum": 1,
          "description": "Planning weight in [0, 1]; higher means the scenario is harder or more risky."
        },
        "expected_doc_ids": {
          "$ref": "#/$defs/stringList",
          "description": "Documents a correct answer is expected to cite. Must be producible by the baseline revision."
        },
        "must_include": {
          "$ref": "#/$defs/stringList",
          "description": "Facts a correct answer must contain. Each entry is scored as keyword coverage, and must be producible by the baseline revision."
        },
        "must_avoid": {
          "$ref": "#/$defs/stringList",
          "description": "Optional phrases that must not appear in the answer."
        },
        "expects_refusal": {
          "type": "boolean",
          "description": "Optional. True when the correct behaviour is a refusal."
        },
        "candidate_drops": {
          "$ref": "#/$defs/stringList",
          "description": "Optional declared defect of the candidate revision."
        },
        "candidate_leaks": {
          "$ref": "#/$defs/stringList",
          "description": "Optional declared disclosure of the candidate revision."
        },
        "hypothesis_domain": {
          "type": "string",
          "minLength": 1,
          "description": "Optional investigation domain, for example knowledge_base or security."
        },
        "hypothesis_kind": {
          "type": "string",
          "minLength": 1,
          "description": "Optional investigation hypothesis kind."
        },
        "hypothesis_title": {
          "type": "string",
          "minLength": 1,
          "description": "Optional human-readable hypothesis for this scenario."
        },
        "suggested_intervention": {
          "type": "string",
          "minLength": 1,
          "description": "Optional intervention used for counterfactual replay. Must be whitelisted by the external SUT."
        },
        "probe_action": {
          "type": "string",
          "minLength": 1,
          "description": "Optional instruction describing the counterfactual probe."
        },
        "recommendation": {
          "type": "string",
          "minLength": 1,
          "description": "Optional remediation text surfaced in the investigation report."
        },
        "browser_url": {
          "type": "string",
          "minLength": 1,
          "description": "Optional page URL for a browser-modality scenario. Supports {{version}} and {{intervention}} placeholders."
        },
        "browser_actions": {
          "type": "array",
          "description": "Optional ordered browser action list for a browser-modality scenario.",
          "items": {
            "$ref": "#/$defs/browserAction"
          }
        }
      }
    },
    "browserAction": {
      "type": "object",
      "required": ["action"],
      "additionalProperties": true,
      "properties": {
        "action": {
          "type": "string",
          "minLength": 1,
          "description": "Action verb from the browser tool vocabulary, for example navigate, click, select, type, wait_for_text, extract_text, assert_text, screenshot."
        },
        "selector": {
          "type": "string",
          "minLength": 1
        },
        "value": {
          "type": "string"
        },
        "text": {
          "type": "string"
        },
        "name": {
          "type": "string",
          "minLength": 1
        }
      }
    }
  }
}
